{
  "schema": "atelier.product-spec-manifest/v1",
  "generated_at": "2026-06-05T06:38:20.027Z",
  "product_spec_root": "harness/knowledge/product-specs/atelier",
  "files": [
    {
      "path": "harness/knowledge/product-specs/atelier/ADAPTER_CONTRACT.md",
      "sha256": "38fda784699e17dc59e6cdbd7dc02defcabe3cf04c375eaf4ff04861d3ca3a6f",
      "bytes": 17804,
      "line_count": 374,
      "heading_count": 20
    },
    {
      "path": "harness/knowledge/product-specs/atelier/CONTRACT_TEST_MATRIX.md",
      "sha256": "b0d72965f30320c0b3efb0a1386f990333852818e6475a998b196a18da0c10aa",
      "bytes": 43407,
      "line_count": 871,
      "heading_count": 39
    },
    {
      "path": "harness/knowledge/product-specs/atelier/EVENT_MODEL.md",
      "sha256": "f98739c816e3555d4af32b96c56de83d34fcd500d2a22e7d250f05f4d93be568",
      "bytes": 15715,
      "line_count": 295,
      "heading_count": 16
    },
    {
      "path": "harness/knowledge/product-specs/atelier/EXAMPLES.md",
      "sha256": "6cfaa48d7c673f43dd63c637692e62d75b1c15b722934f5325513cb69567e187",
      "bytes": 35603,
      "line_count": 894,
      "heading_count": 45
    },
    {
      "path": "harness/knowledge/product-specs/atelier/GRAPH_SEMANTICS.md",
      "sha256": "d52daee9650ffa666a4075cd70b84c32d0ac5d5826bb169dee34d8c1c2b1abd7",
      "bytes": 29003,
      "line_count": 658,
      "heading_count": 44
    },
    {
      "path": "harness/knowledge/product-specs/atelier/HPO_STATE_MODEL.md",
      "sha256": "db0203619abca5ec0f4c6d3d4a6248c573d10d8e78f706d0c9e998c544b4987a",
      "bytes": 14500,
      "line_count": 324,
      "heading_count": 10
    },
    {
      "path": "harness/knowledge/product-specs/atelier/Ideal.md",
      "sha256": "02ef4df3d2e37ab498d002526c7014048b785c791f06ea61b525891c09598c2a",
      "bytes": 21145,
      "line_count": 405,
      "heading_count": 34
    },
    {
      "path": "harness/knowledge/product-specs/atelier/POSITIONING.md",
      "sha256": "8e915c82d92a694068f83de2932839e0f6ea6aa48e8d6987a913eb8868ac8e03",
      "bytes": 21313,
      "line_count": 601,
      "heading_count": 38
    },
    {
      "path": "harness/knowledge/product-specs/atelier/README.md",
      "sha256": "b4b9e255aca19579e5a42cf49c979e802c5c5269fea671d0a7392e355410c372",
      "bytes": 16745,
      "line_count": 365,
      "heading_count": 15
    },
    {
      "path": "harness/knowledge/product-specs/atelier/ROADMAP.md",
      "sha256": "e1afdbbf2b7f1ef7eb4933949817f8d683e6a8bc1ab6e2733a102a14eec2830f",
      "bytes": 22199,
      "line_count": 560,
      "heading_count": 29
    },
    {
      "path": "harness/knowledge/product-specs/atelier/RUN_PACKET_MODEL.md",
      "sha256": "91f9e4d38e9c7743df9238391044d26e4f6baa27841c08892cd84447140b3087",
      "bytes": 4340,
      "line_count": 118,
      "heading_count": 7
    },
    {
      "path": "harness/knowledge/product-specs/atelier/SURFACES.md",
      "sha256": "fed0f2722ba5d1770e8f13ec4cd69f42d9526b8bb3685e009bba4341d1607b50",
      "bytes": 15580,
      "line_count": 379,
      "heading_count": 18
    },
    {
      "path": "harness/knowledge/product-specs/atelier/VERIFICATION_SCHEMA.md",
      "sha256": "a76941b847736113ec72d93b52d9aafb58a537694920a1b15bf7c6455887dc6d",
      "bytes": 20804,
      "line_count": 352,
      "heading_count": 15
    },
    {
      "path": "harness/knowledge/product-specs/atelier/WRITE_AUTHORITY_MATRIX.md",
      "sha256": "782ccec52f32fd2bf1ae018745610ef683f36eaab7407d83fc9aea3a372b2fa7",
      "bytes": 4279,
      "line_count": 102,
      "heading_count": 7
    },
    {
      "path": "harness/knowledge/product-specs/atelier/contract.md",
      "sha256": "3de22827caa36c052c26ed7ad459c09f264077b9230ab1a40051e12231b78c53",
      "bytes": 49133,
      "line_count": 1015,
      "heading_count": 70
    }
  ]
}
